{
  "$schema":"https://json-schema.org/draft/2020-12/schema",
  "type":"object","additionalProperties":false,
  "required":["schema_version","project","date","theme","words","design_palette","cards","caption","hashtags","sources","private_review"],
  "properties":{
    "schema_version":{"const":1},
    "project":{"const":"tifahefendijam-easybosnian-daily-uploads-v1"},
    "date":{"type":"string","format":"date"},
    "theme":{"type":"object","additionalProperties":false,"required":["name","equivalence_keys"],"properties":{"name":{"$ref":"#/$defs/text"},"equivalence_keys":{"$ref":"#/$defs/keys"}}},
    "words":{"type":"array","minItems":3,"maxItems":3,"items":{"type":"object","additionalProperties":false,"required":["lemma","equivalence_keys"],"properties":{"lemma":{"$ref":"#/$defs/text"},"equivalence_keys":{"$ref":"#/$defs/keys"}}}},
    "design_palette":{"enum":["gold-cream","forest-cream","terracotta-sand","blue-ice","rose-ivory","lavender-pearl","mint-linen","coral-cream","slate-silver","plum-blush","charcoal-lemon"]},
    "cards":{"type":"array","minItems":3,"maxItems":3,"items":{"$ref":"#/$defs/card"}},
    "caption":{"type":"string","minLength":10,"maxLength":1600},
    "hashtags":{"type":"array","minItems":3,"maxItems":5,"uniqueItems":true,"items":{"type":"string","pattern":"^#[^\\s#]+$","maxLength":60}},
    "sources":{"type":"array","minItems":1,"items":{"type":"object","additionalProperties":false,"required":["url","title","supports","checked_at"],"properties":{"url":{"type":"string","format":"uri"},"title":{"$ref":"#/$defs/text"},"supports":{"type":"string","minLength":20,"maxLength":800},"checked_at":{"type":"string","format":"date-time"}}}},
    "private_review":{"type":"object","additionalProperties":false,"required":["correct_option","correct_text","explanation","answer_aliases","identifying_hints","standard_bosnian_checked","sources_checked","semantic_history_checked","no_answer_leak_checked","history_checked_at","reviewed_at","reviewer","notes"],"properties":{
      "correct_option":{"enum":["A","B","C"]},"correct_text":{"$ref":"#/$defs/text"},"explanation":{"type":"string","minLength":10,"maxLength":1000},
      "answer_aliases":{"$ref":"#/$defs/keys"},"identifying_hints":{"$ref":"#/$defs/keys"},
      "standard_bosnian_checked":{"type":"boolean"},"sources_checked":{"type":"boolean"},"semantic_history_checked":{"type":"boolean"},"no_answer_leak_checked":{"type":"boolean"},
      "history_checked_at":{"type":"string","format":"date-time"},"reviewed_at":{"type":"string","format":"date-time"},"reviewer":{"$ref":"#/$defs/text"},"notes":{"type":"string","maxLength":2000}
    }}
  },
  "$defs":{
    "text":{"type":"string","minLength":1,"maxLength":180},
    "keys":{"type":"array","minItems":1,"maxItems":40,"uniqueItems":true,"items":{"type":"string","minLength":1,"maxLength":100}},
    "card":{"type":"object","additionalProperties":false,"required":["kind","word","design_template","background_prompt","alt_text"],"properties":{
      "kind":{"enum":["quiz","lesson","word"]},"word":{"$ref":"#/$defs/text"},
      "design_template":{"enum":["editorial","framed","notebook","ribbon","split-cards","minimal","rounded","poster"]},
      "background_prompt":{"type":"string","minLength":100,"maxLength":2048},"alt_text":{"type":"string","minLength":10,"maxLength":300},
      "question":{"type":"string","minLength":5,"maxLength":150},
      "options":{"type":"array","minItems":3,"maxItems":3,"items":{"type":"object","additionalProperties":false,"required":["label","text"],"properties":{"label":{"enum":["A","B","C"]},"text":{"type":"string","minLength":1,"maxLength":100}}}},
      "heading":{"$ref":"#/$defs/text"},"body":{"type":"string","minLength":10,"maxLength":380},"example":{"type":"string","minLength":5,"maxLength":180}
    },"allOf":[
      {"if":{"properties":{"kind":{"const":"quiz"}}},"then":{"required":["question","options"],"not":{"anyOf":[{"required":["heading"]},{"required":["body"]},{"required":["example"]}]}}},
      {"if":{"properties":{"kind":{"enum":["lesson","word"]}}},"then":{"required":["heading","body"],"not":{"anyOf":[{"required":["question"]},{"required":["options"]}]}}},
      {"if":{"properties":{"kind":{"const":"word"}}},"then":{"required":["example"]}}
    ]}
  }
}
